<!DOCTYPE employee
[
<!ELEMENT employees (employee)>
<!ELEMENT employee (name, position, joinyear, salary)>
<!ELEMENT name (#PCDATA)>
<!ELEMENT position (#PCDATA)>
<!ELEMENT joinyear (#PCDATA)>
<!ELEMENT salary (#PCDATA)>
]>